{
  "status": {
    "$nd": {
      "dtype": "u1",
      "shape": [
        1
      ],
      "data": "AA==",
      "sha256": "6e340b9cffb37a989ca544e6bb780a2c78901d3fb33738768511a30617afa01d"
    }
  },
  "endSurface": {
    "$nd": {
      "dtype": "i4",
      "shape": [
        1
      ],
      "data": "/////w==",
      "sha256": "ad95131bc0b799c0b1af477fb14fcf26a6a9f76079e48bf090acb7e8367bfd0e"
    }
  },
  "hits": {
    "$nd": {
      "dtype": "f8",
      "shape": [
        3,
        1,
        3
      ],
      "data": "AAAAAAAAAAAAAAAAAAAAAAAAAAAAAAAAAAAAAAAAAAAAAAAAAAAAAAAAAAAAACRAAAAAAAAAAAAAAAAAAAAAAAAAAAAAAAAA",
      "sha256": "0f340fb19a95c637e8e8f91b2711978a21e39d6b90cd90eed06ba33a2f797fff"
    }
  },
  "exitPoint": {
    "$nd": {
      "dtype": "f8",
      "shape": [
        1,
        3
      ],
      "data": "AAAAAAAAAAAAAAAAAAAAAAAAAAAAAAAA",
      "sha256": "9d908ecfb6b256def8b49a7c504e6c889c4b0e41fe6ce3e01863dd7b61a20aa0"
    }
  },
  "exitDirection": {
    "$nd": {
      "dtype": "f8",
      "shape": [
        1,
        3
      ],
      "data": "AAAAAAAAAAAAAAAAAAAAAAAAAAAAAPC/",
      "sha256": "cf639d4868a9dbde979b7c29a0fcf077ac8aabf5daf99e48dcfbcc1faae0cd9e"
    }
  },
  "imagePoint": {
    "$nd": {
      "dtype": "f8",
      "shape": [
        1,
        3
      ],
      "data": "AAAAAAAAAAAAAAAAAAAAAKuqqqqqqjrA",
      "sha256": "a44fb5ae01c82a8cac5b0fc7977e33b930e6cc5b47cce75fb58241ac94d21dce"
    }
  },
  "opticalPath": {
    "$nd": {
      "dtype": "f8",
      "shape": [
        1
      ],
      "data": "AAAAAAAA+H8=",
      "sha256": "74999fd28ab18ccca2bee199f260d19764603a3c78353d773d16d215eebe8e19"
    }
  },
  "opticalPathToImage": {
    "$nd": {
      "dtype": "f8",
      "shape": [
        1
      ],
      "data": "AAAAAAAA+H8=",
      "sha256": "74999fd28ab18ccca2bee199f260d19764603a3c78353d773d16d215eebe8e19"
    }
  },
  "pathUnavailable": "lv-folded-optical-path-unavailable"
}
