{
  "status": {
    "$nd": {
      "dtype": "u1",
      "shape": [
        1
      ],
      "data": "AA==",
      "sha256": "6e340b9cffb37a989ca544e6bb780a2c78901d3fb33738768511a30617afa01d"
    }
  },
  "endSurface": {
    "$nd": {
      "dtype": "i4",
      "shape": [
        1
      ],
      "data": "/////w==",
      "sha256": "ad95131bc0b799c0b1af477fb14fcf26a6a9f76079e48bf090acb7e8367bfd0e"
    }
  },
  "hits": {
    "$nd": {
      "dtype": "f8",
      "shape": [
        3,
        1,
        3
      ],
      "data": "AAAAAAAAAAAAAAAAAAAAQAAAAAAAAAAAAAAAAAAA+H8AAAAAAAD4fwAAAAAAAPh/AAAAAAAAAAAAAAAAAAAAQAAAAAAAAF5A",
      "sha256": "bc751c251a4296b67dccf7d4e7d731801a3d6867a80cf8f943a418e055fdb7ce"
    }
  },
  "exitPoint": {
    "$nd": {
      "dtype": "f8",
      "shape": [
        1,
        3
      ],
      "data": "AAAAAAAAAAAAAAAAAAAAQAAAAAAAAF5A",
      "sha256": "fb1cbe5a5abad3a9ad0f77bdca8314c157543791494506190fd7c6d4bb9ff66a"
    }
  },
  "exitDirection": {
    "$nd": {
      "dtype": "f8",
      "shape": [
        1,
        3
      ],
      "data": "AAAAAAAAAAAAAAAAAAAAAAAAAAAAAPA/",
      "sha256": "04ae04134c8318578c932394683055fea108f3f586ff5b055613752c5f03e6f5"
    }
  },
  "imagePoint": {
    "$nd": {
      "dtype": "f8",
      "shape": [
        1,
        3
      ],
      "data": "AAAAAAAAAAAAAAAAAAAAQAAAAAAAwGJA",
      "sha256": "9f205f3e7a48d0a32e8e02d79a637b574686ed7ee8e7998b6a96947a4f859b33"
    }
  },
  "opticalPath": {
    "$nd": {
      "dtype": "f8",
      "shape": [
        1
      ],
      "data": "AAAAAABAYEA=",
      "sha256": "bc78e269be658f5ea6d75b79caecdeb79b6ac32fd1e6051dbd86a7ad712ba32d"
    }
  },
  "opticalPathToImage": {
    "$nd": {
      "dtype": "f8",
      "shape": [
        1
      ],
      "data": "AAAAAAAAZEA=",
      "sha256": "254d6f5dd25008755c703b49b2c2db148b4587ffb58ba048fd63beec479ecac1"
    }
  },
  "unrecordedHits": {
    "$nd": {
      "dtype": "u1",
      "shape": [
        3,
        1
      ],
      "data": "AAEA",
      "sha256": "faee935763044f124d7526755a5058a33f9402a595994d59eddd4be8546ff201"
    }
  }
}
